{
  "id": "quiz-who-are-you",
  "contentType": "assessment",
  "title": "Find Your Path in the Protocol",
  "description": "A brief quiz to help you discover which epic domain resonates with you",
  "content": [
    {
      "id": "d-q1",
      "purpose": "discovery",
      "content": {
        "content": "Which of these activities interests you most?\n\n[[☃ radio 1]]",
        "images": {},
        "widgets": {
          "radio 1": {
            "type": "radio",
            "options": {
              "choices": [
                { "content": "Shaping AI policy and constitutional frameworks", "id": "d-q1-choice-0" },
                { "content": "Supporting caregivers and recognizing invisible work", "id": "d-q1-choice-1" },
                { "content": "Transforming workplace ownership and governance", "id": "d-q1-choice-2" },
                { "content": "Civic participation and public oversight", "id": "d-q1-choice-3" },
                { "content": "Building healthier digital communication spaces", "id": "d-q1-choice-4" }
              ],
              "randomize": false,
              "multipleSelect": false
            },
            "graded": false,
            "version": { "major": 0, "minor": 0 }
          }
        }
      },
      "subscaleContributions": {
        "radio 1": {
          "0": { "governance": 1, "care": 0, "economic": 0, "public": 0, "social": 0 },
          "1": { "governance": 0, "care": 1, "economic": 0, "public": 0, "social": 0 },
          "2": { "governance": 0, "care": 0, "economic": 1, "public": 0, "social": 0 },
          "3": { "governance": 0, "care": 0, "economic": 0, "public": 1, "social": 0 },
          "4": { "governance": 0, "care": 0, "economic": 0, "public": 0, "social": 1 }
        }
      },
      "metadata": {
        "sourceContentId": "quiz-who-are-you",
        "bloomsLevel": "remember",
        "difficulty": "medium",
        "estimatedTimeSeconds": 30,
        "questionType": "core",
        "tags": ["discovery", "onboarding", "personalization"],
        "instrumentId": "epic-domain"
      }
    },
    {
      "id": "d-q2",
      "purpose": "discovery",
      "content": {
        "content": "What aspect of the current system concerns you most?\n\n[[☃ radio 1]]",
        "images": {},
        "widgets": {
          "radio 1": {
            "type": "radio",
            "options": {
              "choices": [
                { "content": "AI systems making decisions without democratic oversight", "id": "d-q2-choice-0" },
                { "content": "Unpaid care work being invisible in our economy", "id": "d-q2-choice-1" },
                { "content": "Workers having no voice in their workplaces", "id": "d-q2-choice-2" },
                { "content": "Citizens being disconnected from decision-making", "id": "d-q2-choice-3" },
                { "content": "Social media amplifying division and misinformation", "id": "d-q2-choice-4" }
              ],
              "randomize": false,
              "multipleSelect": false
            },
            "graded": false,
            "version": { "major": 0, "minor": 0 }
          }
        }
      },
      "subscaleContributions": {
        "radio 1": {
          "0": { "governance": 1, "care": 0, "economic": 0, "public": 0, "social": 0 },
          "1": { "governance": 0, "care": 1, "economic": 0, "public": 0, "social": 0 },
          "2": { "governance": 0, "care": 0, "economic": 1, "public": 0, "social": 0 },
          "3": { "governance": 0, "care": 0, "economic": 0, "public": 1, "social": 0 },
          "4": { "governance": 0, "care": 0, "economic": 0, "public": 0, "social": 1 }
        }
      },
      "metadata": {
        "sourceContentId": "quiz-who-are-you",
        "bloomsLevel": "remember",
        "difficulty": "medium",
        "estimatedTimeSeconds": 30,
        "questionType": "core",
        "tags": ["discovery", "onboarding", "personalization"],
        "instrumentId": "epic-domain"
      }
    }
  ],
  "contentFormat": "sophia-moment-json",
  "tags": ["assessment", "onboarding", "personalization", "discovery"],
  "relatedNodeIds": ["governance", "value_scanner", "public_observer", "autonomous_entity", "social_medium"],
  "metadata": {
    "assessmentType": "discovery",
    "recommendsEpics": true,
    "quizType": "domain-discovery",
    "category": "onboarding",
    "questionCount": 2,
    "instrumentId": "epic-domain"
  }
}
