{
  "id": "quiz-governance-foundations",
  "contentType": "assessment",
  "title": "Governance Foundations",
  "description": "Test your understanding of constitutional AI governance principles",
  "content": [
    {
      "id": "gf-q1",
      "purpose": "mastery",
      "content": {
        "content": "What is the primary purpose of Elohim agents in governance?\n\n[[☃ radio 1]]",
        "images": {},
        "widgets": {
          "radio 1": {
            "type": "radio",
            "options": {
              "choices": [
                { "content": "To make all decisions for humans", "correct": false, "id": "gf-q1-choice-0" },
                { "content": "To serve as constitutional guardians while respecting human agency", "correct": true, "id": "gf-q1-choice-1" },
                { "content": "To maximize engagement metrics", "correct": false, "id": "gf-q1-choice-2" },
                { "content": "To enforce rules without exception", "correct": false, "id": "gf-q1-choice-3" }
              ],
              "randomize": true,
              "multipleSelect": false
            },
            "graded": true,
            "version": { "major": 0, "minor": 0 }
          }
        }
      },
      "hints": [
        {
          "content": "Elohim serve as guardians of constitutional principles while preserving human agency and dignity.",
          "images": {},
          "widgets": {}
        }
      ],
      "metadata": {
        "sourceContentId": "quiz-governance-foundations",
        "assessesContentId": "governance-epic",
        "bloomsLevel": "remember",
        "difficulty": "medium",
        "estimatedTimeSeconds": 30,
        "questionType": "core",
        "tags": ["governance", "foundations", "assessment"]
      }
    },
    {
      "id": "gf-q2",
      "purpose": "mastery",
      "content": {
        "content": "Every governance decision in the protocol can be challenged.\n\n[[☃ radio 1]]",
        "images": {},
        "widgets": {
          "radio 1": {
            "type": "radio",
            "options": {
              "choices": [
                { "content": "True", "correct": true, "id": "gf-q2-true" },
                { "content": "False", "correct": false, "id": "gf-q2-false" }
              ],
              "randomize": false,
              "multipleSelect": false
            },
            "graded": true,
            "version": { "major": 0, "minor": 0 }
          }
        }
      },
      "hints": [
        {
          "content": "The right to challenge is constitutional - no decision is exempt from review.",
          "images": {},
          "widgets": {}
        }
      ],
      "metadata": {
        "sourceContentId": "quiz-governance-foundations",
        "assessesContentId": "governance-epic",
        "bloomsLevel": "remember",
        "difficulty": "easy",
        "estimatedTimeSeconds": 15,
        "questionType": "core",
        "tags": ["governance", "true-false"]
      }
    }
  ],
  "contentFormat": "sophia-moment-json",
  "tags": ["assessment", "governance", "foundations"],
  "relatedNodeIds": ["governance-epic"],
  "metadata": {
    "assessmentType": "mastery",
    "category": "governance",
    "attestationId": "governance-foundations",
    "difficulty": "medium",
    "questionCount": 2
  }
}
